S No.,Title,Words,Sentiment
2845,Karnataka Bank net profit during October-December up 33% at Rs 106 crore,12,positive
2846,Karur Vysya Bank Q3 net profit rises marginally to Rs 113.88 Crore,12,positive
2847,Karur Vysya Bank Q4 net up 17 pc at Rs 115 cr,12,positive
2848,KEC International's Q4 net profit up over 25% at Rs 78.58 cr,12,positive
2849,KPTL shares surge 7% as company bags orders worth Rs 560 crore,12,positive
2850,Liberty Shoes Q2 net up 25.24 per cent at Rs 2.53 crore,12,positive
2851,Liquidity flowing into emerging markets will help Hindalco move up: Seshadri Bharathan,12,positive
2852,Lock & load: Bharat Forge hits all-time high on Rafael arms JV,12,positive
2853,"Low valuations, price corrections make Jubilant Life Sciences a good stock pick",12,positive
2854,Man Industries surges over 19% intraday on Rs 510 crore export order,12,positive
2855,Manappuram Finance plans to garner up to Rs 200 cr via NCDs,12,positive
2856,Mangalore Refinery and Petrochemicals  shares gain over 11% on robust earnings,12,positive
2857,Maruti has potential to rise 10-15% if market sentiment improves: Deven Choksey.,12,positive
2858,Mastek Net up over two-fold at Rs 20.3 cr in Jan-Mar qtr,12,positive
2859,Mastek rallies over 40% in 5 trading session on potential value unlocking,12,positive
2860,Mastek: Lower operating costs and lesser forex loss result in margin expansion,12,positive
2861,"MF exposure to bank stocks hit record high of Rs 85,000 crore",12,positive
2862,MphasiS gains 2% as Q3 profit rises 7% to Rs 209 crore,12,positive
2863,"Nagarjuna Construction can give return of 20-25%: Gajendra Nagpal, Unicon Financial Solutions",12,positive
2864,NBCC IPO hits capital market to raise Rs 120 crore for government,12,positive
2865,NBFCs seeing good Q2 numbers on fall in input cost: Deepak Shenoy,12,positive
2866,Next year is going to be phenomenal for Indian equities: Vikas Khemani,12,positive
2867,"Nifty's upward move about to resume: Sandeep Wagle, APTART Technical Advisory Services",12,positive
2868,Nikkei ends day with marginal gains as BOJ keeps monetary policy unchanged,12,positive
2869,Nokia Solutions and Networks reports Q1 net profit of 124 million euro,12,neutral
2870,"NPCIL rides corporate bond wave, to raise up to Rs 2,500 crore",12,neutral
2871,"ONGC Videsh H1 profit rises 14.4 per cent to Rs 1,886 crore",12,positive
2872,Opto Circuits gains over 12% on stake sale reports to Goldman Sachs,12,positive
2873,Oriental Bank of Commerce Q4 Net rises marginally to Rs 310 crore,12,positive
2874,PE firm Apax buys TPGs 20.3% stake in Shriram City Union Finance,12,positive
2875,Penny stocks soar 30-90 per cent post global and local stimulus measures,12,positive
2876,Persistent Net up 37 pc at Rs 57 cr; revenues rise 19%,12,positive
2877,Pia Singh buys over 1.31 crore DLF shares for Rs 194 crore,12,positive
2878,Premium valuation for TCS justified among large cap IT stocks: Dipan Mehta,12,positive
2879,"Pre-open: Nifty likely to open on positive note, find support at 8,100",12,positive
2880,PSU bank stocks might be great contrarian buys next year: Nitin Jain,12,positive
2881,Q4 earnings: RIL's profit jumps up 32 pc on rising refining income,12,positive
2882,"QE3 will be good for the Indian markets: Pankaj Pandey, ICICI Direct",12,neutral
2883,Quasi private sector banks provide good opportunities: Mehraboon Irani Nirmal Bang Securities,12,positive
2884,"Railway expansion plans bound to benefit Titagarh, other big players: Deepak Shenoy",12,positive
2885,"Rajesh Exports climbs on bagging an export order worth Rs 1,122 crore",12,positive
2886,Ramco Systems gains as company may raise Rs 300 cr through QIP,12,positive
2887,Rashtriya Chemicals and Fertilisers Q1 net profit up by 65 per cent,12,positive
2888,"Raymond a good pick in the textile space: Anil Rego, Right Horizons",12,positive
2889,Refined soya oil futures gain 1.02 per cent on strong spot demand,12,positive
2890,Reforms pushed by Narendra Modi government likely to attract investors to PSUs,12,positive
2891,"Relaxo Footwears rallies 20%, hits 52-week high on dividend, bonus issue plans",12,positive
2892,Replacement demand for tyres to benefit the stocks going forward: Prateek Agarwal,12,positive
2893,Rolta India net up 25.3 pc at Rs 84.04 cr for Jan-Mar,12,positive
2894,Rupee rises to over 6-month high vs US dollar on FII inflows,12,positive
2895,Russia adds to gold holdings for 5th month in a row: IMF,12,positive
2896,Sandhar Tech seeks Sebi nod to raise Rs 300 cr via IPO,12,positive
2897,Sasken shares up 20% as it wins $31.7 million in arbitration case,12,positive
2898,Satyam may see big rerating after merger with Tech Mahindra: Ambit Capital,12,positive
2899,"SBI scales above Rs 2,000 levels on $1 bn fund raising plans",12,positive
2900,"See this week's upside continuing in next week too: Mitesh Thacker, miteshthacker.com",12,neutral
2901,Sensex pares gains after hitting record highs; top ten stocks in focus,12,positive
2902,Sesa net at Rs 1.62K crore; hopes to resume mining post monsoon,12,positive
2903,"Seven blue-chips add Rs 25,098 crore in market-cap; Tata Motors top gainer",12,positive
2904,"Shipping Corporation has seen a lot of upside: Gautam Shah, JM Financial",12,positive
2905,Shivanand Mankekar makes a profit of Rs 150 crore on United Spirits,12,negative
2906,"Shree Cement net profit surge by 537% on better realisations, operational efficiencies",12,positive
2907,Shri Lakshmi Cotsyn March qtr net up 9.05% to Rs 27.70 cr,12,positive
2908,Shriram City Union Finance Q2 profit rises 10.5% to Rs 152.31 crore,12,positive
2909,Shriram City Union Finance Q4 Net rises 21% to Rs 151 crore,12,positive
2910,Siemens Ltd net profit rises two-fold to Rs 88.3 crore in January-March,12,positive
2911,Singapore index rises ahead of price data; others flat on Greek debt,12,positive
2912,Sistema deal will help RCom launch 4G services later on: Nitin Soni,12,positive
2913,SJVN's profit after tax jumps 8.87% to Rs 343.24 cr in Q1,12,positive
2914,Solar power stocks rally upto 11% on Indo-US partnership on clean energy,12,positive
2915,"Spice India debuts in Delhi; will offer spices-infused chocolate slabs, beauty creams",12,neutral
2916,Standard Chartered jumps 5 per cent on Sebi move on IDR conversion,12,positive
2917,"Steria India sees exits at top; CEO, HR head, SVP Finance quit",12,neutral
2918,Sterling index at six-week high as chances of BoE rate hike grow,12,positive
2919,"Structural tailwinds will aid IT companies and IT stocks, says Vinay Khattar",12,positive
2920,Subex rallies nearly 5% on reports of buyout by global tech firms,12,positive
2921,"Sun Pharma-Ranbaxy deal clears a big hurdle, secures NSE & BSE nod",12,positive
2922,Sutlej Textiles Q3 profit jumps 61.47 per cent to Rs 39.90 crore,12,positive
2923,Suven Life Sciences Q2 net profit up 7-fold at Rs 45.54 crore,12,positive
2924,Suzlon Energy rallies 20% in two sessions as Q4 net loss narrows,12,positive
2925,Syndicate Bank Q2 net up 5 per cent at Rs 332 crore,12,positive
2926,"Syngene International makes stellar debut, ends day up 24% over issue price",12,positive
2927,"Tax sops to oil companies will be helpful: Ashith Kampani, JM Financial",12,neutral
2928,"Texmaco Rail rallies over 8% as consortium wins Rs 1,800 crore order",12,positive
2929,There is great opportunity and great future for Power Grid: Sudip Bandyopadhyay,12,positive
2930,Torrent Power rallies as Q2 net profit rose to Rs 246.27 crore,12,positive
2931,Trent rallies over 6% as Tesco completes establishment of a 50:50 JV,12,positive
2932,TV Today Network Q3 jumps 34.46 per cent to Rs 20.64 crore,12,positive
2933,TV Today surges 8 per cent on increase in FII investment limit,12,positive
2934,UB Group to hike stake in MCFL; to buy shares from Zuari,12,positive
2935,Uflex rallies nearly 8% as Q2 net profit grows by over 40%,12,positive
2936,"United Breweries gains 28% in four days on bourses, valuations look stretched",12,positive
2937,USL stock up 3% as Diageo buys shares; ups stake to 29%,12,positive
2938,V-Guard rallies 12% as Q4 net profit doubles to Rs 20.5 crores,12,positive
2939,V-Guard: Bullish on growth due to diversification and expansion in new markets,12,positive
2940,"Waiting for levels of around 310 to buy Bharti: Ambareesh Baliga, Karvy",12,positive
2941,Whirlpool India Q1 profit grows 18 per cent at Rs 98.1 crore,12,positive
2942,"Would buy Hindustan Motors above 30: Sandeep Wagle, APTART Technical Advisory Services",12,positive
2943,Yen rises after Bank of Japan holds fire on further easing measures,12,positive
2944,Yes Bank registers 30% rise in Q2 profit on higher fee income,12,positive
2945,"Yuan firms in late trade, set for biggest daily rise since March",12,positive
2946,4450 to 4480 may be next support range for Bank Nifty: Mitesh Thacker,13,positive
2947,Adani Enterprises surges 13%; experts say surge in group stocks likely to continue,13,positive
2948,Advanta rallies over 12% as Q3 net profit grows to Rs 25.42 crore,13,positive
2949,AirAsia shares gain 8 per cent after report it may be taken private,13,positive
2950,Ajanta Pharma Q2 net profit up 41 per cent at Rs 78.63 crore,13,positive
2951,"Aptech's roof on the upside is 115 to 117: Ashwani Gujral, Market Strategist",13,positive
2952,"ARSS Infra gets Rs 114.49 cr order, stock jumps by over 7 pc",13,positive
2953,"AstraZeneca up 20% on delisting proposal, locked in upper circuit at Rs 1,110.90",13,positive
2954,"Automotive segment looks to be a winner: Raamdeo Agrawal, Motilal Oswal Financial Services",13,positive
2955,"Balrampur Chini strongest in the sugar space: Sandeep Wagle, APTART Technical Advisory Services",13,positive
2956,Bata is a great long term bet for 10-15 years period: Sudip Bandyopadhyay,13,positive
2957,Best time for the insurance companies to list to attract investment: Deepak Shenoy,13,positive
2958,Bond yields end up tracking oil prices; biggest weekly rise in 2-1/2 months,13,positive
2959,"Break above 8,060 on Nifty may trigger 100-point rally on index: Mitesh Thacker",13,positive
2960,"Break above 8,340 on Nifty can trigger 100-point rally on index: Mitesh Thacker",13,positive
2961,Colgate Palmolive India Q2 net up 21 per cent at Rs 157 crore,13,positive
2962,Consistent performance behind Bajaj Finance's premium valuations; stock a long-term play: Deven Choksey,13,positive
2963,"Contrarian view: Domestic institutional investors see opportunity in Bharti Airtel, Maruti Suzuki stocks",13,positive
2964,Crisil Q4 net profit moves up 17 pc to over Rs 45 cr,13,positive
2965,"DCM Shriram Consolidated rallies 17%, hits 52-week high on plans to reward shareholders",13,positive
2966,Decision on cut in government stake structurally positive for Dena Bank: Amit Khurana,13,positive
2967,Delta Corp rallies nearly 5% as Jhunjhuwala buys stake worth Rs 11 crore,13,positive
2968,Deutsche Bank sees Sensex 20% up in 2014; top  7 midcap ideas,13,positive
2969,Diageo launches $1.9 billion second open offer to hike USL stake to 55%,13,positive
2970,Economic revival for Concor anticipated; limited upside for stock seen in short term,13,neutral
2971,"Edelweiss clocks Rs 66 cr profit in Q2, total income up by 44%",13,neutral
2972,Edelweiss doubles investor wealth in 2014; Rakesh Jhunjhunwala picks up 1 crore shares,13,positive
2973,Eicher Motors Q2 net profit rises 41 per cent to Rs 222 crore,13,positive
2974,"Equity outclasses gold, realty; 10 stocks where MFs raised stake in June quarter",13,positive
2975,Fertilizer manufacturer Coromandel International Q3 net profit up 38% at Rs 94 crore,13,positive
2976,FIIs' interest in India nears peak; top eight stocks from CLSA's model portfolio,13,neutral
2977,FMCGs are a good bet on revival of the Indian economy: Dipan Mehta,13,positive
2978,Further 5 per cent fall on Dalal Street good to enter: Axis MF,13,positive
2979,GAIL Q2 PAT beats estimates at Rs 1303 crore; stock at 52-week high,13,positive
2980,"Gateway Distriparks is a good bet with a one-year view: Avinnash Gorakssakar, Mintdirect.com",13,positive
2981,Geometric rallies 4% post Q1 results; net profit rises to Rs 19.2 crore,13,positive
2982,Gillette India net profit up 11.9% to Rs 42.89 cr for Sept quarter,13,positive
2983,"Havells a good buy even at current levels: Taher Badshah, Motilal Oswal AM",13,positive
2984,HCL Technologies hits 52-week high post Q3 results; logs 20% gain in 2013,13,positive
2985,HFCs offer great value even at prevailing levels; prefer Repco Home: Vinay Khattar,13,positive
2986,Hindi daily Amar Ujala plans to raise Rs 300 via IPO next month,13,positive
2987,"HNIs remain bullish; saw record inflows in August: Prateek Agarwal, ASK Investment Manager",13,neutral
2988,Huge demand-supply gap in Infra; constraints in projects taking shape: K Ravi Kumar,13,neutral
2989,"ICICI Bank Q2 net profit up 15% to Rs 2,709 crore; beats estimates",13,positive
2990,"Ideal time to get into FMCG companies: Gurunath Mudlapur, Atherstone Capital Markets Ltd",13,positive
2991,IDFC Banks a good long-term bet even if it makes a slow start,13,positive
2992,"IL&FS Transportation is a good pick at current levels: Ambareesh Baliga, Market Expert",13,positive
2993,ING Vysya net jumps 34% to Rs 170 cr on improved asset quality,13,positive
2994,Ipca to give good returns on US and domestic trade traction: Manish Sonthalia,13,positive
2995,"IRF daily turnover swells nearly three times to Rs 2,562 crore on NSE",13,positive
2996,"It makes good sense for Sesa Sterlite to pick HZL stake, say analysts",13,positive
2997,J&K Bank Q1 net profit rises 35 per cent to Rs 246 crore,13,positive
2998,Jain Irrigation shares rally over 4% on plans to sell wind power business,13,positive
2999,"Jet, SpiceJet shares Soars on Etihad Deal as brokers turned bullish on aviation",13,positive
3000,"JLR poised to be world's 4th biggest luxury car maker, says Citi report",13,positive
3001,Jubilant Foodworks surges over 3% to hit record high; plans pizzas on train,13,positive
3002,"Just Dial gains over 2% on Credit Suisse upgrade, Tiger Global stake sale",13,positive
3003,Kansai Nerolac Paints Q2 net up 9.07 per cent to Rs 51.7 crore,13,positive
3004,Kansai Nerolac Q1 net up 19.77 per cent jump at Rs 72.98 crore,13,positive
3005,Larger part of story for Mahindra & Mahindra remains intact: KR Choksey Securities,13,positive
3006,Larsen & Toubro's Q1 net profit soars 111% on sale of assets and stake,13,positive
3007,"Like in 2009, will rupee shoot up 300 paise post May 16 verdict?",13,neutral
3008,"Like it or not, China's crude oil futures will be a global benchmark",13,positive
3009,"Long term outlook on Cairn India positive: Sandeep Wagle, APTART Technical Advisory Services",13,positive
3010,"Mahindra & Mahindra lags forecast, Q4 net up 6.4% at Rs 606.5 cr",13,positive
3011,Mangalore Refinery And Petrochemicals rallies 6% on reports of merger plans with OMPL,13,positive
3012,M-cap of Adani stocks surges 85% in seven months: Time to book profits?,13,positive
3013,Metals sector an interesting opportunity from medium to long-tem view: P Phani Sekhar,13,positive
3014,Mid-cap mantra: Persistent Systems' buying spree to give it a bounce in H2,13,positive
3015,"Morgan Stanley, Barclays buy Claris bulk shares in open market on USFDA clearance",13,positive
3016,Motherson Sumi Systems shares rise more than 5.5% on hopes on good earnings,13,positive
3017,Much to cheer in telecom; here's how companies fared in the spectrum auction,13,positive
3018,Multibagger idea: Bank of America- Merrill Lynch sees 65% upside in Jaiprakash Associates,13,positive
3019,Natco Pharma rallies over 8% as US Court rejects stay request on Copaxone,13,positive
3020,"NBCC surges 5% as co bags order worth Rs 3,000 crore from AIIMS",13,positive
3021,NBFCs rally as RBI likely to give bank licences in next 10-15 days,13,positive
3022,"NDA may give PSU stocks a fillip, Narendra Modis Gujarat success spurs hope",13,positive
3023,"Near-term trajectory of PSU banks shaky, but buy stocks on dips: Parag Thakkar",13,positive
3024,"Next leg of Nifty rally will be led by PSU banks, say analysts",13,positive
3025,Neyveli Lignite shares gain as Sebi gives Tamil Nadu consent to buy stake,13,positive
3026,Oberoi Realty Q4 net up by 30.16% at Rs 136.7 crore; stock down,13,positive
3027,OMC stocks may continue to perform well in next 3-6 months: Harendra Kumar,13,positive
3028,"On banking front, valuations are attractive from fundamental perspective: Phani Sekhar, Angel Broking",13,positive
3029,"Operating leverage will flow in for logistic companies, if economy improves: Dhiraj Sachdev",13,positive
3030,"Optimism about rupee grows, Barclays cuts one-month forecast to 59 vs US dollar",13,positive
3031,Oriental Bank of Commerce Q1 net profit rises 3% to Rs 365 crore,13,positive
3032,PBoC says China stocks rout almost over; is it good news for India?,13,neutral
3033,"Pininfarina buy, Chennai floods do not affect Tech M: Gaurav Mehta, Ambit Capital",13,positive
3034,"Pipavav could be game changer with Mahindras coming in: Vinay Khattar, Edelweiss Financial",13,positive
3035,Pipavav Defense likely to restructure Rs 7000 cr debt via CDR; stock up,13,positive
3036,"Polaris is a favourite of investors and traders: Avinash Gorakshekar, Edelweiss Financial Advisors",13,positive
3037,Pre-election rally: BSE benchmark index hits lifetime high as FIIs pump $1 billion,13,positive
3038,Procter & Gamble net up 55.03 pc at Rs 80.76 cr in January-March,13,positive
3039,Prop desks build bullish bets on Nifty with hopes to make 6-fold returns,13,positive
3040,Prospects of a BJP-led government at the Centre prompt buying in PSU stocks,13,positive
3041,Q4 weakness a temporary blip; buy largecap IT stocks on dips: Neeraj Deewan,13,positive
3042,"Raised Infosys' weightage in portfolios post Q2 numbers: Sachin Shah, Emkay Investment Managers",13,positive
3043,"Rajasthan mining approval from Supreme Court, right investments prop up Birla Corp stock",13,positive
3044,Ramky Infrastructure rallies 18% on sale of 3 highway projects to Pirmal Group,13,positive
3045,"Rate cut in April can take markets higher: Mehraboon Irani, Nirmal Bang Securities",13,neutral
3046,Raymond: Focus on branded offerings should help boost sales & profitability in long-term,13,positive
3047,Results across the board in banking would be much above expectation: Ajay Srivastava,13,neutral
3048,"Risk-averse investors should prefer Sun Pharma over SPARC: Daljeet Singh Kohli, IndiaNivesh Ltd",13,positive
3049,"Securities Appellate Tribunal allows DLF to redeem Rs 1,806 crore in mutual funds",13,neutral
3050,Sharp rally in RIL helps Nifty cross 9000 for the first time ever,13,positive
3051,"Small investors find merit in beaten-down midcaps like KFA, Suzlon Energy, Lanco Infra",13,positive
3052,"Smallcap capital goods players stare at big opportunities, look attractive bets: Harendra Kumar",13,positive
3053,Southeast Asian markets rise on Greek debt deal; Thai benchmark recovers two-week low,13,positive
3054,Speciality chemical companies to gain as production moves out of China: Vinay Khattar,13,positive
3055,"Spice Mobility to invest Rs 1,000 crore for expansion this fiscal; stock up",13,positive
3056,Stay long on Sun TV with stop loss of Rs 380: Vinith Jain,13,positive
3057,Street @ new peak: Opto Circuits surges over 8%; top 20 stock bets,13,positive
3058,"Strong pipeline of films, low-risk business model drives net profit of Eros International",13,positive
3059,"Suzlon Energy rallies 57% in June, is it a good time to buy?",13,positive
3060,Swiss Finance Corp buys 70 lakh Apollo Tyres shares for Rs 50 cr,13,positive
3061,Tata Motors stock to soar again over JLR volumes and renewed FII interest,13,positive
3062,Thomas Cook India PAT for 2013 grows by 36% to Rs 68.7 crore,13,positive
3063,"Transport Corporation of India in pole position to gain from ecommerce boom, GST",13,positive
3064,Tremendous value in midcap companies; top 5 wealth-creating ideas for next 6-12 months,13,positive
3065,"US stocks rise amid positive US, eurozone data; push Nasdaq to new record",13,positive
3066,Voltas rises post Q4 results; net profit up 17.55% to Rs 118.04 cr,13,positive
3067,Welcome Samvat 2072! Sensex ends 124 points higher; top 10 wealth creating ideas,13,positive
3068,"Yen gains on safety play, euro edges away from 9-year lows vs dollar",13,positive
3069,"73 is the level to watch out on Lanco Infrastructure: Kunal Saraogi, Technical Analyst",14,positive
3070,ABG Shipyard ends 13.3% higher on buzz L&T plans to buy stake in firm,14,positive
3071,Atul Auto net profit up by 26% at Rs 3.87 crore in June quarter,14,positive
3072,"Bharti Airtel Q4 net profit surges by 89% to Rs 962 crore, meets estimates",14,positive
3073,Bharti Infratel fourth quarter net profit may rise  by 36 per cent: Report,14,positive
3074,Both private and PSU banks look good at this point in time: Arindam Ghosh,14,positive
3075,Cadila stock touches 52 week high after gettting USFDA approval for two generic drugs,14,positive
3076,"CLSA cuts target price for RIL to Rs 1,150, but retains a 'buy' call",14,positive
3077,"CMC may spring positive surprise next week, among small cap IT names: Avinnash Gorakssakar",14,positive
3078,"Cyclicals will continue to be in focus in the medium-term: Kunj Bansal, Centrum Wealth",14,positive
3079,"Dhoni's CSK will play IPL, says SC; India Cements on the ball, up 8%",14,positive
3080,"Diageo makes $1.9 bn second open offer, USL surges 15%: Should investors tender shares",14,positive
3081,Educomp Solutions rallies 10% on talks to sell its business schools to AB Group,14,positive
3082,Escorts posts 77 pc jump in Q2 net profit; to set up new plant,14,positive
3083,"Festive season likely to trigger turnaround for auto stocks: Dhiraj Sachdev, HSBC AM India",14,positive
3084,FIIs to pump $2.55 billion into Indian debt market; Rupee set to strengthen further,14,positive
3085,"Force Motors doubles in 2 weeks, vrooms 400% in 1 year; should you buy?",14,positive
3086,Foreign Guar Gum buyers return after prices crash by more than 50 per cent,14,positive
3087,"FTIL sells stake in NBHC for Rs 300 crore, say sources; stock surges 14%",14,positive
3088,Gateway Distriparks rallies nearly 5% on reports that it plans to list rail unit,14,positive
3089,"Goldman, Barclays see value in banks; top ten long term bets for your portfolio",14,positive
3090,"HDFC Bank Q4 net up 30 per cent at Rs 1890 crore, meets forecast",14,positive
3091,"Heritage Food, RSWM top two stocks ideas for next 3 months: G Chokkalingam, Equinomics",14,positive
3092,HSIL rallies 11% after RBI allows FIIs to buy shares; ends nearly 3% down,14,positive
3093,Hyundai outbids Samsung to pay sky-high $10 billion for land in South Korea's Gangnam,14,neutral
3094,"IndusInd Bank presents an interesting entry opportunity for new investors: Phani Sekhar, Angel Broking",14,positive
3095,JustDial Ltd is a 'BUY' call with a target of Rs 1550: Mitesh Thacker,14,positive
3096,"KEC International looks attractive on revenue visibility and margin improvement: Mayuresh Joshi, Angel Broking",14,positive
3097,Kesoram Industries rallies over 18% on reports to sell its tyre unit to MRF,14,positive
3098,"Life Insurance Corporation of India may buy ICICI infrastructure bonds worth Rs 3,000 crores",14,neutral
3099,"Long term investors should stay invested in Tata Steel: Seshadri Bharathan, KSEMA Fincon Ltd.",14,positive
3100,Marico posts 28 per cent jump in Q1 net profit to Rs 238 crore,14,positive
3101,MM Forgings reaps twin benefits on record US sales and India demand rev up,14,positive
3102,"Money on the street: You could earn Rs 16,000 by betting on Bata futures",14,positive
3103,"Narendra Modi wave revives as FIIs buy over Rs 2,300 crore in Nifty futures",14,positive
3104,"Novartis India surges 20% as parent company strikes $15 billion deal with GSK, Lilly",14,positive
3105,Novelis third quarter net profit jumps 3-fold to $46 million on new business model,14,positive
3106,Oriental Bank of Commerce's Q1net profit up 3 per cent to Rs 365 crore,14,positive
3107,Procter and Gamble Q2 net profit up 18.40 per cent at Rs 90.66 crore,14,positive
3108,"PVR rallies over 4%, hits fresh 52-week high on plans to buy SPI Cinemas",14,positive
3109,"Rajan pulls off a surprise, cuts repo rate by 50 basis points, stocks rally",14,positive
3110,"REITs will benefit companies involved in portfolio of commercial properties: Prakash Diwan, Altamount Capital",14,neutral
3111,Renuka Sugars Board gives in-principal nod for rights issue to raise Rs 725.4 crore,14,positive
3112,"Scope for further improvement in valuation multiple for midcap IT stocks: G Chokkalingam, Equinomics",14,positive
3113,Sectoral churning behind recent correction in pharma stocks; present valuations look attractive: Gaurav Mehta,14,positive
3114,"Seeing a large delta swing favouring Escorts in FY 2012: Avinash Gorakshekar, Anagram Capital",14,positive
3115,Share of LNG in India's gas mix may rise to 38 per cent: Goldman,14,positive
3116,South Korean shares gain more than 1 per cent as financials rally; won higher,14,positive
3117,Suggest to put money into PSU names from a long term perspective: Sudip Bandyopadhyay,14,positive
3118,"Technical check: Yes Bank on track to hit levels of 1000, says Reliance Securities",14,positive
3119,UB stocks gain up to 57 per cent so far this fiscal; outshine Sensex,14,positive
3120,Volkswagen shares bounce back from lows to show gain of 4% in late morning,14,positive
3121,Yes Bank Q3 up 30% YoY to Rs 540 crore; in line with estimates,14,positive
3122,8600-8620 levels to be key support area for Nifty in the coming days: Mitesh Thacker,15,positive
3123,Ajanta Pharma Q2 net up 20 per cent at Rs 100 crore on robust sales,15,positive
3124,Ambuja a good bet in the cement space; buy at levels of 210-211: Ambareesh Baliga,15,positive
3125,Anil Ambani Group firm Reliance Infra Q3 net profit jumps 26% at Rs 450 crore,15,positive
