S No.,Title,Words,Sentiment
7940,"Quality stocks will lead the rally: Vijai Mantri, Pramerica MF",10,neutral
7941,Rail stocks gather momentum as Suresh Prabhu tables Railway Budget,10,positive
7942,Ranbaxy Laboratories posts a better-than-expected net profit; stock up 4.5%,10,positive
7943,Rashtriya Ispat Nigam Ltd posts 25% growth in FY14 turnover,10,positive
7944,"Rate-sensitive stocks could do well post elections: Jyotivardhan Jaipuria, BofA-ML",10,neutral
7945,Rate-sensitives trade cautiously ahead of RBI meet; IB Realty surges,10,positive
7946,Reforms push will hold good for the markets: Dhiraj Sachdev,10,neutral
7947,Revival of the hydropower sector to bode well for NHPC,10,positive
7948,Right time to build long positions on Nifty: Ashwani Gujral,10,positive
7949,Ruchi Soya Q3 Net up 33.35% at Rs 36.54 crore,10,positive
7950,"Rupee recovers by 21 paise, trades at 61.28 against dollar",10,positive
7951,S K Nationwide's profit soars 44.5% to Rs 33.09 cr,10,positive
7952,SAIL Q4 profit marginally up 1.35% at Rs 452.58 crore,10,positive
7953,Saksoft surges over 15% on acquiring stake in ThreeSixty Logica,10,positive
7954,Sebi revokes capital market ban on Trendline and its founder,10,positive
7955,Sector-wide consolidation and improving fundamentals will boost Shoppers Stop's valuation,10,positive
7956,"See a Nifty upmove, but not overly long: Sandeep Wagle",10,neutral
7957,Sensex can correct max by 5-10%; uptrend remains intact: Analysts,10,positive
7958,Sensex makes fresh life high; top 15 stocks in focus,10,positive
7959,Servalakshmi Paper debuts at over 3 pc premium on BSE,10,positive
7960,Shalimar Paints trims early gains; stock ends over 2% up,10,positive
7961,Shanthi Gears Q4 Net jumps 91.4% to Rs 3.67 crore,10,positive
7962,Shilpi Cable Technologies rallies as Q1 net profit jumps 55%,10,positive
7963,Shoppers Stop may raise upto Rs 350-cr through QIP route,10,positive
7964,"Shrinking discounts, volume growth to keep Maruti Suzuki on track",10,positive
7965,"SIB posts higher Q2 net, to focus on CASA funds",10,positive
7966,Silver moves up in futures trade on higher global trend,10,positive
7967,"Silver, gold jump on festival season demand, Asian market cues",10,positive
7968,Sinclairs Hotels Q1 net profit up at Rs 2.67 crore,10,positive
7969,Sintex Industries Q4 net up 23% to Rs 197.78 crore,10,positive
7970,Softer oil prices boost expectations of an earnings growth recovery,10,positive
7971,Sony shares hit 3-month high after Q1 profit beats estimates,10,positive
7972,Southeast Asian stocks rise; Indonesia rebounds ahead of rate decision,10,positive
7973,Southern Petrochemicals up 9.8% on HC nod for debt waiver,10,positive
7974,Spot demand lifts lead prices by 0.69% at futures trade,10,positive
7975,Srei Infra shares zoom 14% on BNP Paribas stake buying,10,positive
7976,Srei Infrastructure Finance shares rise over 5% on fund-raising buzz,10,positive
7977,SRF Q1 profit after tax doubles to Rs 44 crore,10,positive
7978,State-run iron ore miner NMDC now in Nifty 50 index,10,positive
7979,"Sugar output up 15%, cane arrears cross Rs 12k crore",10,positive
7980,Sundaram Finance Q1 Net jumps 22.3% to Rs 115.99 crore,10,positive
7981,Supreme Industries Q3 net up 38.67% at Rs 75.83 crore,10,positive
7982,"Surge in Bosch doesn't bewilder me: Ambareesh Baliga, Market Expert",10,positive
7983,Swaraj Engines share price surges as company announces 330% dividend,10,positive
7984,Symphony Q4 net up over 26% at Rs 32.73 crore,10,positive
7985,TajGVK Hotels & Resorts Q3 net up at 12.91 crore,10,positive
7986,Take Solutions net profit up 115.8% at Rs 69.99 crore,10,positive
7987,T-Bill rates spurt as investors link price to term repo,10,positive
7988,Tech Mahindra may turn positive after 580 levels: Mitesh Thacker,10,positive
7989,Thermax surges over 8 per cent on strong Q2 results,10,positive
7990,"Thin world markets rally may run longer, draw new cash",10,positive
7991,Tokyo stocks close up 2.11%; rides on upbeat China data,10,positive
7992,Trident Ltd Q3 shoots over 3-fold to Rs 50.9 crore,10,positive
7993,TV Today Network Q2 up 84% at Rs 24.31 crore,10,positive
7994,"Unity Infra could give a decent upside: Hemang Jani, Sharekhan",10,positive
7995,"Upside expected in the market, post-budget : KR Choksey Securities",10,positive
7996,Uptick in demand lifts turmeric futures by 1.44 per cent,10,positive
7997,Urad climbs by Rs 500 per quintal on tight supply,10,positive
7998,US stocks: Strong data stops the bleeding on Wall Street,10,positive
7999,USFDA reports no observations in Granules India plant; stock surges,10,positive
8000,Usha Martin gains 18 per cent on coal block wins,10,positive
8001,Ushdev International Q4 profit up 81% at Rs 57.58 crore,10,positive
8002,Vaswani Industries IPO over subscribed 3.87 times on final day,10,positive
8003,Venus Remedies get UK approval for cancer drug; stock up,10,positive
8004,"View on Reliance Industries remains bullish: Shardul Kulkarni, Angel Broking",10,positive
8005,VIP Industries Q1 Net up 16.52% at Rs 26.8 crore,10,positive
8006,Watch out for Infosys in the IT space: Dipan Mehta,10,positive
8007,Wealthy investors lap up NHAI's Rs 10k cr bond issue,10,positive
8008,"Wheat futures up 0.80 per cent on export, spot demand",10,positive
8009,When Sebi turned bullish on bringing back trust to markets!,10,positive
8010,Whirlpool Q1 net profit jumps 26% at Rs 64.55 crore,10,positive
8011,Why you should buy L&T at lows despite weak earnings,10,positive
8012,Wockhardt surges 12% as HP drug controller revokes drug suspension,10,positive
8013,World's biggest airport operator AENA jumps 20.7% in market debut,10,positive
8014,ZEEL Q3 up 44.48 per cent to Rs 308.61 crore,10,positive
8015,"Zinc futures up 0.55 pc on overseas cues, spot demand",10,positive
8016,100 days of Vishal Sikka: Infosys up at 16.12 per cent,11,positive
8017,155 stocks hit 52-week high as markets set new lifetime peaks,11,positive
8018,"22,214 is new closing high for Sensex: Top bets from experts",11,positive
8019,8K Miles Software net profit surges 60% to Rs 2.76 crore,11,positive
8020,Aanjaneya Lifecare Q1 Net up 68 pc at Rs 18.93 crore,11,positive
8021,"Agri stocks spike as Cabinet okays Rs 50,000-cr Krishi Sinchai Yojana",11,positive
8022,Ajanta Pharma Q4 net profit up 20% at Rs 84.31 crore,11,positive
8023,Allahabad Bank Q2 net profit up by over 20 per cent,11,positive
8024,"Alstom India, CMC gain as Sadananda Gowda presents Rail Budget 2014",11,positive
8025,Amara Raja Batteries Q1 net up 8% to Rs 106 crore,11,positive
8026,"Attractive opportunities in midcap space:  Arindam Ghosh, Blackridge Capital Advisors",11,positive
8027,Axis Bank is heading to levels closer to 1595: Prakash Gaba,11,positive
8028,Bajaj Auto Q1 PAT seen 2.4% up at Rs 735 crore,11,positive
8029,BEL available with decent valuation of about 15-16 times: Hemang Jani,11,positive
8030,Berger Paints Q4 Net up 26.34 pc at Rs 55.34 crore,11,positive
8031,Bharti Infratel hits 52-week high on tower deal with Reliance Jio,11,positive
8032,BHEL rallies on strong order book; rises 10% in two days,11,positive
8033,"Bhusan Steel surges 14% as asset sale fetches Rs 3,000 crore",11,positive
8034,Bhushan Steel looks good over medium to long term: Ashit Suri,11,positive
8035,"Bilcare signs $61 mn deal with United Drug, stock up 16%",11,positive
8036,"Bluestar: Low costs, rise in other income help post better profit",11,positive
8037,BofA Merrill Lynch bullish on energy sector as oil price steadies,11,positive
8038,Brokers say 'buy' even as Sobha Developers slips post Q1 results,11,positive
8039,"Bulls on the rampage, tailwinds take FMCG, pharma to fresh highs",11,positive
8040,Buy Cummins India with a target of Rs 950: Mitesh Thacker,11,positive
8041,Buy Glenmark Pharma with a target of Rs 834: Sandeep Wagle,11,positive
8042,BUY' Voltas Ltd with a target of Rs 365 :Ashwani Gujral,11,positive
8043,Buying opportunities may emerge in Asian oil and gas space: Macquarie,11,positive
8044,Calculus: New management's focus on earnings bodes well for Crompton Greaves,11,positive
8045,Can expect ICICI bank to scale up further : Rajat Bose,11,positive
8046,"Career Point is a great company: Avinash Gorakshekar, Anagram Capital Ltd",11,positive
8047,Cement sector has good scope for appreciation in long-term: Amisha Vora,11,positive
8048,Central Bank of India raises Rs 500 crore through bond offer,11,positive
8049,CERC order a new lease of life for Adani Power: CLSA,11,positive
8050,"CERC order likely to boost Tata Powers credit quality, says Moodys",11,positive
8051,Charting Technicals: Investors can expect a multi-year bull run in Wipro,11,positive
8052,Choppiness to reduce after Nifty goes past 8700 levels: Mitesh Thacker,11,positive
8053,City Union Bank gains 2% on strong response to share sale,11,positive
8054,City Union Bank Q4 Net rises 1% to Rs 83.34 crore,11,positive
8055,CMC FY13 net jumps 52 pc jump to Rs 230 crore,11,positive
8056,CMC's fourth-quarter profit rises 45.8 per cent to Rs 89.43 crore,11,positive
8057,"Coffee stocks in for some good times: Deepak Shenoy, Capital Mind",11,positive
8058,Cognizant Q1 revenue rises 20% to $2.42 billion; signals bullish outlook,11,positive
8059,Commexes turnover to cross Rs 112 lakh crore in 2010-11 fiscal,11,positive
8060,Cosmo Films Q1 net up 4 folds to Rs 18.42 crore,11,positive
8061,Dabur Q1 net up 13.33 per cent at Rs 210.81 cr,11,positive
8062,Dalal Street flummoxed as Mangalore Chemicals and Fertilisers shares defy gravity,11,positive
8063,DCM Shriram up over 2%; hits record high on land sale,11,positive
8064,"Debt funds look more attractive in the short term, say experts",11,positive
8065,"Demand pick-up, stable prices help Hexaware post Rs 42 crore net",11,positive
8066,Development Corporation Bank a unique player in MSME segment: Avinnash Gorakssakar,11,positive
8067,Dhanuka Agritech Q3 net profit up 82% at Rs 21.27 crore,11,positive
8068,Divis Labs Q3 net up 45.07 pc to Rs 98.42 cr,11,positive
8069,"Dollar sits tight near six-month high ahead of Fed meeting, data",11,positive
8070,Dr. Reddys could be very good long term investments: Deepak Mohoni,11,positive
8071,DSCL Q1 net jumps over three fold to Rs 114 crore,11,positive
8072,Dynamic bond funds a good bet in falling interest rate scenario,11,positive
8073,EIH Q4 profit up 35 per cent at Rs 36.44 crore,11,positive
8074,EIL shares surge over 6% as board to mull interim dividend,11,positive
8075,Elder Pharma Dec qtr net up 2.34% to Rs 15.73 cr,11,positive
8076,Elder Pharma Q4 net up 2.73 pc to Rs 17.27 cr,11,positive
8077,Emmbi Polyarns PAT up 46.65 per cent to Rs 2.56 crore,11,positive
8078,Engineers India Q4 net up 32.54 pc to Rs 165.57 cr,11,positive
8079,European operations puts Motherson Sumi overseas order book on fast track,11,positive
8080,Everonn Education net profit up near 49% at Rs 67.63 crore,11,positive
8081,Extremely positive on RIL; stock may see rerating:  Mayuresh Joshi,11,positive
8082,Federal Bank Q1 net profit rises 30% to Rs 190.35 crore,11,positive
8083,Financial Technologies rallies over 8% on signing technology contract with MCX,11,positive
8084,FIPB allows IndusInd Bank hike FII limit to 74%; stock rallies,11,positive
8085,Firstsource may appreciate between 40-80% in next nine months: Mehraboon Irani,11,positive
8086,French company Arkema picks up 25% stake in Jayant Agro's arm,11,positive
8087,Future Retail raises Rs 500 cr via private placement of NCDs,11,positive
8088,Gas stocks jump on report RasGas may modify SPA with Petronet,11,positive
8089,"GCPL extends winning streak, up 14% in 5 sessions; more upside?",11,positive
8090,Geojit BNP Paribas Q1 profit almost doubles to Rs 16.48 crore,11,positive
8091,GlaxoSmithKline 2010 net profit up 10.37 pc to Rs 560.57 cr,11,positive
8092,"Government bond market doesnt need fixing, says Raghuram Rajan, governor, RBI",11,neutral
8093,Greek crisis: Tech analysts predict a rebound; Nifty could bounce 3-4%,11,positive
8094,"Green shoots of economic recovery visible; Nifty seen at 8,000 levels",11,positive
8095,"GSPC raises Rs 3,000cr through bond markets to meet capex need",11,positive
8096,"Have a buy rating on HCL Tech: Pankaj Pandey, ICICI Direct",11,positive
8097,Havells Q2 Net up 1 per cent to Rs 113 crore,11,positive
8098,HCC rallies 5% on completion of first tunnel for Kishanganga project,11,positive
8099,Hewlett-Packard Co: Shares up after report it will split in two,11,positive
8100,"Hexaware's Q2 revenue rises 5.6%, helped by growth in Europe, US",11,positive
8101,Hike in LPG and diesel to reduce subsidy bill: UR Bhat,11,positive
8102,"Hind Copper eyes better margin, Rs 273-cr net profit in FY'14",11,positive
8103,"Hotel industry on path of revival; EIH, Indian Hotels top bets",11,positive
8104,Housing Development and Infrastructure Ltd stocks rise above 5 per cent,11,positive
8105,Housing finance companies gain as much as 9.3% on RBI move,11,positive
8106,HPCL Q3 net profit up nearly 7-fold at Rs 211.03 cr,11,positive
8107,ICICI Bank gains over 1% after board approves 1:5 stock split,11,positive
8108,IDBI Bank raises $300mn via overseas bond sale at 5.06% coupon,11,positive
8109,IDFC sees potential of 30-40% upside in 6-9 months: Devang Mehta,11,positive
8110,IFC raises Rs 300 crore more from global rupee bond sale,11,positive
8111,IFCI Q1 net rises 7.5 per cent to Rs 102 crore,11,positive
8112,Iffco plans to export fertilizers due to drop in domestic demand,11,positive
8113,IGL surges on reports SC declines PNGRB permit to hold enquiry,11,positive
8114,IHCL: More room to grow as occupancy shows signs of improvement,11,positive
8115,IMFA's Q4 net up over 28 pc at Rs 24.48 cr,11,positive
8116,Indiabulls Housing Finance Q4 net up 21% at Rs 367.59 crore,11,positive
8117,"Indo Count top bet in textile sector: Vinay Khattar, Edelweiss Financial",11,positive
8118,"Indonesia's richest get $9 billion hit on commodity, currency doldrums: Forbes",11,neutral
8119,"Infosys consolidated Q2 net profit at Rs 3,398 crore, above estimates",11,positive
8120,Infotech Enterprises PAT rises 12% to Rs 69.4 crore in October-December,11,positive
8121,Infotech Enterprises: Investors should use the correction to buy the stock,11,positive
8122,Infra stocks a good buy from a long-term perspective: Sudip Bandyopadhyay,11,positive
8123,Insurance companies rally up to 7% as government clears Insurance Bill,11,positive
8124,Intel could rise 30 per cent over next two years: Report,11,positive
8125,International Finance Corporation raises $100 million in maiden onshore Maharaja Bonds,11,positive
8126,Investors can use intraday dips to buy into markets: Mitesh Thacker,11,positive
8127,IVRCL rallies over 8% on assets sale plan to pare debt,11,positive
8128,"J&K Bank a good buy at current levels: Pankaj Pandey, ICICIdirect.com",11,positive
8129,"Jet Airways flies nearly 20% post Etihad deal, hits 52-week high",11,positive
8130,Jewellery major Rajesh Exports clocks 64.2% jump in PAT in FY12,11,positive
8131,JP Infratech is a very very unique project of the country',11,positive
8132,JSPL surges as Delhi HC stops auction of two coal blocks,11,positive
8133,JSW Steel Q4 net profit up 29.88% at Rs 793.63 crore,11,positive
8134,Jyothy Labs looks interesting over a two-three year timeframe: IDBI Capital,11,positive
8135,Kalindee Rail promoters plan to hike stake to avoid take over,11,positive
8136,Kansai Nerolac rallies over 8% as Q1 net profit jumps 19.77%,11,positive
8137,Karur Vysya Bank Q2 profit surges 57% to Rs 142 crore,11,positive
8138,Karur Vysya Bank Q3 net up marginally to Rs 113.88 Cr,11,positive
8139,Kesoram promoters infuse Rs 200 cr to raise stake to 49%,11,positive
8140,Kirloskar Oil Engines Q1 profit jumps 35% to Rs 52.89 crore,11,positive
8141,Kitex Garments surges nearly 60% in four sessions on robust results,11,positive
8142,KKR buys 9% in IPO-bound Avantha Power for Rs 217 cr,11,positive
8143,Kolkata IT expert Bikram Dasgupta appointed World Bank advisor to Bangladesh,11,neutral
8144,Lanco Infratech rallies as lenders approve higher cost for 4 projects,11,positive
8145,"Large move is on way for RIL: CK Narayan, Sharyans Resources",11,positive
8146,LIC Housing Finance Q3 profit up 38% at Rs 326.59 crore,11,positive
8147,"Local investors should buy equities; infra, auto favourable spaces: Deven Choksey",11,positive
8148,"Look at PSU banks from 12-15 months perspective: Pankaj Pandey, ICICIdirect.com",11,positive
8149,Lyka Labs to raise up to Rs 100 crore via securities,11,positive
8150,Market sees 8% to 10% upside in this quarter: Apurva Shah,11,positive
8151,Media report on DVR led Tata Motors to surge: Jagdish Malkani,11,positive
8152,"Midcaps important part of our portfolio: Kunj Bansal, Centrum Wealth Management",11,neutral
8153,Mirc Electronics Q4 net up 87 pc at Rs 9.7 cr,11,positive
8154,Monnet Ispat surges nearly 13% on likely stake sale by promoters,11,positive
8155,Moody's gives fifth reason for markets to cheer; record highs seen,11,positive
8156,MTNL well placed for a next probable upmove: Aditya Birla Money,11,positive
8157,"Mutual funds create history in August, invest more money than FIIs",11,positive
8158,Mutual funds' exposure to IT stocks hit 5-month high in July,11,positive
8159,Natco Pharma shares jump 15% on Dilip Shanghvi stake buy reports,11,positive
8160,"NBFC space looks attractive, but valuations are fairly stretched: Anand Tandon",11,positive
8161,Nestle India recovers after slipping 5%; Global CEO says Maggi safe,11,positive
8162,"Next 3 years will be transformational for RIL, says Mukesh Ambani",11,positive
8163,NFL share sale subscribed 1.55 times; govt gets Rs 101 cr,11,positive
8164,"Nifty to go beyond 6800, may even reach 7000: Ambareesh Baliga",11,positive
8165,NIIT bounces back to profits; revenue rises to Rs 225.3 crore,11,positive
8166,"Nikkei hits 5-mth high on Federal  policy hopes, China PMI",11,positive
8167,"Nikkei hits 7-yr high, hopes of BOJ buying stocks offsets Moody's",11,positive
8168,"Nikkei rises as MSCI review supports sentiment, eyes on BOJ meeting",11,positive
8169,"Nomura Holdings Inc: Sensex to touch 30,310 points by August 2015",11,positive
8170,Novartis India Q4 net profit up 22.30% at Rs 34 crore,11,positive
8171,Nucleus Software Q4 net up 19 pc to Rs 10.45 cr,11,positive
8172,Nucleus Software's Q1 net profit up 4% at Rs 11.65 crore,11,positive
8173,Oil's 45% rebound could be testing nerves of markets and policymakers,11,positive
8174,Opto Circuits Q4 net profit up 68% at Rs 111.05 crore,11,positive
8175,"Opto Circuits unveils latest AED in US, Canada; stock rallies 9%",11,positive
8176,"Oracle Financial FY'11 net profit up 43.60% to Rs 1,111 crore",11,positive
8177,"Outlook not bleak for Infosys going ahead: Prakash Diwan, Altamount Capital",11,positive
8178,"Paper cos to publish better Q1 nos, soaring demand brightens outlook",11,positive
8179,Pfizer rallies over 6% on acquisition plans; scales above Rs 2000,11,positive
8180,Polishing image: Fixing of supply chain issues may rerate Bata India,11,positive
8181,"Power Finance Corp Q3 profit jumps 37% at Rs 1,534.31 crore",11,positive
8182,"Power Finance Corporation FPO fairly priced: Sajiv Dhawan, JV Capital Services",11,positive
8183,"Power Finance Corporation raises Rs 2,100 crore by selling privately-placed bonds",11,positive
8184,Power plant operators surge as government plans to boost LNG imports,11,positive
8185,Praj Industries order booking is picking up substantially:  Sandip Sabharwal,11,positive
8186,"Prestige Estates Q2 sales bookings up 29% at Rs 1,486 crore",11,positive
8187,"Prime Focus up 18% in 2 days, can gain 15% more",11,positive
8188,"Punj Lloyd surges 5% as it bags Rs 1,418 crore order",11,positive
8189,"Q1 numbers, crude oulook, midcap rally lifting tyre stocks: Harendra Kumar",11,positive
8190,Radico Khaitan Q4 net profit up 81% at Rs 17.4 crore,11,positive
8191,"Ramco Systems surges on pact with Australian firm, up 100% YTD",11,positive
8192,RBS surges 5 per cent on forming JV with CBS Corp,11,positive
8193,"RComm a good stock in the telecom space: Deepak Mohoni, trendwatchindia.com",11,positive
8194,"REC gets shareholders nod to raise up to Rs 42,000 crore",11,positive
8195,Reiterate 'Buy' on Infosys for target of Rs 3250: Prabhudas Lilladher,11,positive
8196,"Reliance Communications raises Rs 6,100 crore via QIP to reduce debt",11,positive
8197,Relief over China growth pushes dollar to 1-week high versus yen,11,positive
8198,Responsive Industries could be a multibagger in the making: Prakash Diwan,11,positive
8199,RIICO FY'12 net profit up nearly 68% at Rs 473.44 crore,11,positive
8200,Rolta India shares gain almost 12 per cent on smart earnings,11,positive
8201,Rural Electrification Corp raises 15.15 billion rupees via 7-yr bonds: Sources,11,positive
8202,Samsung shares could gain as much as 50 per cent: Barron's,11,positive
8203,Sanofi India stock likely to be re-rated on company's improving fundamentals,11,positive
8204,Saraswat Bank posts 78% growth in net profit at Rs 212.27-cr,11,positive
8205,SAT upholds Sebi order on 9 entities in Rich Universe case,11,negative
8206,SBBJ Q1 net up 11.83 per cent at Rs 187.52 crore,11,positive
8207,"Sensex makes new record high at 22,853; top 20 trading ideas",11,positive
8208,"Sensex soars about 400 points; makes fresh life high of 25,416",11,positive
8209,Shalimar Paints Q2 increases 48.02 per cent to Rs 4.13 crore,11,positive
8210,Shanghai stocks see biggest one-day gain in more than five years,11,positive
8211,Sharekhan picks top investment ideas as market fall makes valuations reasonable,11,neutral
8212,Sharp movement in Yen has been positive for Maruti: Prashastha Seth,11,positive
8213,Shree Cement January-March net profit up 26% to Rs 274 crore,11,positive
8214,"Singapore dollar near 1-month high after easing, GDP; Asia FX up",11,positive
8215,SJVN records 28 per cent rise in net profit in October-December,11,positive
8216,SKF India Q1 PAT up 40 pc at Rs 61 cr,11,positive
8217,"SKS scrip snaps losing streak, ends 3% up after rate reduction",11,positive
8218,Small stocks give better returns to investors so far this year,11,positive
8219,"Sobha Developers heading to 200, JP stuck at 90: Ashwani Gujral",11,positive
8220,Sobha Developers Q1 PAT seen up 48% at Rs 46 cr,11,positive
8221,Sobha Developers: A realty counter that may give over 45% returns,11,positive
8222,Sona Koyo Steering Systems Q2 net up at Rs 12.62 crore,11,positive
8223,"Sovereign gold bond scheme more likely to succeed, says Nomura report",11,positive
8224,Soybeans rise to 10-month high after record crush in US mills,11,positive
8225,SRF Q2 profit jumps 60.87 per cent to Rs 76.85 crore,11,positive
8226,"Stage set for IT sector to see bounceback, top stock picks",11,positive
8227,Star Network's Balaji exit sparks excitement in entertainment space: Deven Choksey,11,neutral
8228,State Bank of India rallies over 1% on fund raising plans,11,positive
8229,Sterling heads towards first week of gains in 8 against dollar,11,positive
8230,Sterlite Tech Q4 profit jumps 4-fold; to hive off power biz,11,positive
8231,Stimulus efforts to lift silver assets  ETFs to a record,11,positive
8232,Supreme Industries Q4 net up 12 pc at Rs 105 crore,11,positive
8233,Surya Roshni Q1 net profit up 22% at Rs 12 crore,11,positive
8234,Suven Life Sciences Q1 net up 16.68% at Rs 34.74 cr,11,positive
8235,Taiwan stocks up slightly on caution ahead of key orders data,11,positive
8236,Talbros Auto top bet from auto componenet space: P Phani Sekhar,11,positive
8237,Tata Chemicals Q1 net jumps over two-fold to Rs 175.50 crore,11,positive
8238,TBZ net profit rises 58% to Rs 18.49 crore in Q4,11,positive
8239,"Techno Electric's Q1 FY13 PAT at Rs 40.7 crore, up 24%",11,positive
8240,There is still lot of interest in IT stocks: Anil Manghnani,11,positive
8241,"These are good times to buy: Vijai Mantri, Pramerica Mutual Fund",11,neutral
8242,Time for CNX IT to hit a new high: Ashwani Gujral,11,positive
8243,"Top-6 blue-chips add Rs 38,362 cr in m-cap; TCS biggest gainer",11,positive
8244,Traders bullish on natural gas even as inventories may show rise,11,positive
8245,Trent to raise up to Rs 250 cr through shares sale,11,positive
8246,TTML narrows down net loss to Rs 156.36 crore in Q3,11,positive
8247,Turnaround in biz fortunes helps ABNL post a profit in Q3,11,positive
8248,TVS Motor Q2 net jumps over two-fold at Rs 54.78 crore,11,positive
8249,UB group stocks surge upto 20% on Diageo stake buy talks,11,positive
8250,"UltraTech Cement hits 52-week high on Nifty inclusion, Lupin up 2%",11,positive
8251,United Breweries Holdings Q1 jumps over 2-fold to Rs 802 crore,11,positive
8252,Uptrend in IT likely to continue; buy on declines: Ashwani Gujral,11,positive
8253,"Urban theme looks good given the deficient monsoon: Pankaj Pandey, ICICIdirect.com",11,positive
8254,"Vakrangee, Petronet among top 45 stocks that hit their 52-week highs",11,positive
8255,Valuation gap with larger peer makes Stylam Industries an attractive option,11,positive
8256,Varun Shipping FY11 profit up 17.45 pc at Rs 14.74 crore,11,positive
8257,Venus Remedies Q2 net up 4.5 pc to Rs 11.5 cr,11,positive
8258,V-Mart Q1 net up 26.15 per cent at Rs 9.02 crore,11,positive
8259,Volkswagen stocks rise 4% over better than expected third quarter earnings,11,positive
8260,Watch arm's e-tail success helps KDDL tick at a faster rate,11,positive
8261,Welspun India Q4 net profit jumps 83% to Rs 98.66 crore,11,positive
8262,Wipro share auction fetches Rs 750 cr for Azim Premji Trust,11,positive
8263,"Would prefer India Infoline in NBFC space: Pankaj Pandey, ICICI Direct",11,positive
8264,Zee Entertainment Q1 net profit up 16% at Rs 243 crore,11,positive
8265,100 days of Narendra Modi government: Sensex rallies nearly 9%; top bets,12,positive
8266,10-year yield at over 2-week high as RBI says to cut HTM,12,positive
8267,40-50% earnings growth expected for Amara Raja Batteries in FY11: Anagram Capital,12,positive
